keys,en,pt_BR
DISCLAIMER_1,"Disclaimer 1: This story and the names, places, and countries mentioned in it are completely fictitious. Any resemblance to anything, any person living or dead, or any event in real life is just a co-incidence.","Aviso 1: Essa história e os nomes, lugares, e países mencionados nela não completamente fictícios. Qualquer semelhança com qualquer coisa, qual pessoa viva ou morta, ou qualquer evento da vida real são apenas coincidências."
DISCLAIMER_2,"Disclaimer 2: The following story is narrated by a character, whose views and opinions the author or anyone else in the team does not agree with. The idea with said narration is to present a story of complicated characters, whose viewpoints and POV may not be good or reliable. The purpose of this tale is not to offend any person on their sexuality, race, gender, appearance, or nationality. The sole purpose is to present a mysterious tale that may have a main character who is complicated in his views and behavior, and the same thing is with the characters around him. Still, in case of any discomfort, you are free to turn the game off, and move onto something lighter. Also, one last thing, take this or any other jam submission at your own reading pace, and try not to rush them. All the entries have something important to say or tell, and the more you soak each word in with patience, the better the experience. With these out of the way, please enjoy this short tale that we hastily put together for 2023's Nanoreno Jam. Hopefully in time to not be disqualified.","Aviso 2: A história a seguir é narrada por um personagem cujos pensamentos e opiniões o autor ou qualquer outra pessoa do time não concordam. A ideia com essa narrativa é apresentar uma história de personagens complexos, cujas ideias e perspectivas podem não ser boas ou confiáveis. O propósito desse conto não é ofender nenhuma pessoa ou sua sexualidade, raça, gênero, aparência, ou nacionalidade. O único propósito é apresentar um conto misterioso que pode ter um personagem principal complicado quanto a suas ideias e comportamento, e o mesmo com os personagens ao redor dele. Ainda assim, em caso de qualquer desconforto, você tem a liberdade de desligar o jogo, e ir para alguma outra coisa mais leve. E também, uma última coisa, jogue essa história ou qualquer outra participante da jam no seu próprio ritmo de leitura, e tente não correr com nenhuma. Todas as histórias têm algo importante para contar ou dizer, e quando mais você absorver cada palavra com paciência, melhor será a experiência. Dito isso, por favor aproveite esse curto conto feito às pressas para a Nanoreno Jam 2023. Com sorte a tempo de não sermos desqualificados."
DISCLAIMER_3,"Disclaimer 3: In case you are a Let's Player/Streamer somehow finding this very obscure piece of game and then having to find themselves narrate to your audience, speaking all of the words bit-by-bit in your lovely voice. Well, then all I can say is....stay hydrated.","Aviso 3: Caso você seja um Let's Player/Streamer que de algum modo encontrou esse jogo muito obscuro e então tenha que narrá-lo à sua audiência, falando todas as palavras com sua adorável voz. Bem, então tudo o que eu posso dizer é... Hidrate-se."
ACT_1_TITLE,ACT ONE: A Stressful Day,ATO UM: Um Dia Estressante
ACT_1_1.1,"Oh, hello!","Oh, olá!"
ACT_1_1.2,Good to see you here.,Que bom te ver aqui.
ACT_1_1.3,Please stay for a while in our great nation of [i]Yhafa[/i].,"Por favor, fique um pouco na nossa grande nação de [i]Yhafa[/i]."
ACT_1_1.4,"I can ensure you that it is a beautiful country,","Posso te garantir que é um país lindo,"
ACT_1_1.5,"filled with rich country music that pledges our loyalty towards the motherland,","cheio de música popular rica que jura lealdade à pátria mãe,"
ACT_1_1.6,with grasses that sway with the ever colder winds of our mountains,com grama que se agita com o sempre gélido vento de nossas montanhas
ACT_1_1.7,"and working people with ever widening smiles on their faces,","e pessoas trabalhadores com sorrisos sempre amplos em seus rostos,"
ACT_1_1.8,living in a nation that stands at the height of prosperity in major areas of human development ...,vivendo em uma nação no ápice da prosperidade em diversas áreas do desenvolvimento humano...
ACT_1_1.9,"like filmmaking, agriculture exports, lithium mines, ethnic unification, weapons research & development, and worshiping by economic leaders from other countries ...","como criação de filmes, exportação agrícola, mineração de lítio, unificação ética, pesquisa & desenvolvimento de armas, e adoração de líderes econômicos de outros países..."
ACT_1_1.10,and soon enough I ensure you that we will be a global superpower....,e logo eu posso te garantir que seremos uma superpotência global...
ACT_1_2.1,"Well, I might be getting ahead of myself right now,","Bem, eu posso estar me apressando no momento,"
ACT_1_2.2,sorry for that.,desculpe-me por isso.
ACT_1_2.3,"You are new to my country,","Você acabou de chegar ao meu país,"
ACT_1_2.4,and so you might take some time to adapt.,então pode precisar de um tempo para se adaptar.
ACT_1_2.5,"Anyway,","De qualquer modo,"
ACT_1_2.6,"it is nice to meet you,","é um prazer te conhecer,"
ACT_1_2.7,my name is....,meu nome é...
ACT_1_3.1,Ronan Isidro.,Ronan Isidro.
ACT_1_4.1,"I am the Head Clerk and Head Communication manager of the second division of the unit, Terra-3.","Sou o Escrivão Chefe e gerente Chefe de Comunicação da segunda divisão da unidade, Terra-3."
ACT_1_4.2,"Terra-3 is very important for the [i]Yhafa[/i] army, as we are the backbone of all communications between many-a-sectors of the military.","Terra-3 é muito importante para o exército de [i]Yhafa[/i], pois somos os responsáveis por toda a comunicação entre muitos setores militares."
ACT_1_4.3,"Therefore, I am responsible for many high rank communications that are carried out between the higher ups at the military of [i]Yhafa[/i] and the brave soldiers working on the ground.","Portanto, eu sou responsável por muitas comunicações de alto nível que são transmitidas entre os superiores militares de [i]Yhafa[/i] e os bravos soldados trabalhando no campo."
ACT_1_5.1,"I am a passionate patriot, as everyone should be.","Sou um patriota apaixonado, assim como todos deveriam ser."
ACT_1_5.2,"In fact, my first ever memory was not that of seeing the smiling face of my mother,","Na verdade, minha primeira memória não foi de ver o rosto sorridente de minha mãe,"
ACT_1_5.3,"who was weak enough to die giving birth to me, leaving me to spend the rest of my childhood with my father's second wife until I was eight, and then spent the rest of my teenage years in the military boarding school.","que era fraca demais e morreu dando à luz a mim, deixando-me passar o resto da minha infância com a segunda esposa do meu pai até eu ter oito anos, e então passar o resto da minha adolescência em uma escola militar."
ACT_1_5.4,"By the time that I graduated and started becoming a part of the military itself, my father had already married two more times.","Quando eu me graduara e ingressei de fato no regime militar, meu pai já havia se casado mais duas vezes."
ACT_1_5.5,The latest being with a woman that was two years younger than me.,A última vez com uma mulher dois anos mais nova do que eu.
ACT_1_5.6,How's my father now?,Como está meu pai agora?
ACT_1_5.7,"Well, for all I know, he still probably lives on the high mountains in that mansion of his,","Bem, pelo que eu sei, ele provavelmente ainda vive nas montanhas naquela mansão dele,"
ACT_1_5.8,accompanied by his riches and that young wife of his.,acompanhado de sua riqueza e daquela jovem esposa dele.
ACT_1_5.9,We haven't been in contact for ten years at this point and despite my father's plea-filled letters to my wife;,Não nos comunicamos há dez anos e apesar das cartas repletas de pedidos de meu pai enviadas à minha esposa;
ACT_1_5.10,I would prefer it to stay that way.,Eu prefiro que continue desse jeito.
ACT_1_6.1,"Sorry about that, you know how it can be sometimes with families and old stuff.","Desculpe por isso, você sabe como essas coisas de família podem ser."
ACT_1_6.2,"My father was never loyal, but just so you know, I have pledged to myself, my wife, and my country that I wish to stay loyal and faithful to my one beloved. ","Meu pai nunca fora leal, mas para que você saiba, eu jurei a mim mesmo, à minha esposa, e ao meu país de que eu desejo ser leal e fiel apenas à minha amada."
ACT_1_6.3,"After all, any poster in [i]Yhafa[/i] can tell you that a healthy family is where the father and mother stick together,","Afinal de contas, qualquer pôster em [i]Yhafa[/i] pode te contar que uma família saudável é aquela em que o pai e a mãe permanecem juntos,"
ACT_1_6.4,"and they produce one son for the nation's defenses,","e produzem um filho para a defesa da nação,"
ACT_1_6.5,"and one daughter for the nation's populace,","e uma filha para a população da nação,"
ACT_1_6.6,"and I believe in that message whole-heartedly,","e eu acredito totalmente nessa mensagem,"
ACT_1_6.7,"for even if you are not from [i]Yhafa[/i],","pois mesmo que você não seja de [i]Yhafa[/i],"
ACT_1_6.8,won't you agree that it is the,você não concorda que essa é a
ACT_1_6.9,perfect family combination!,combinação familiar perfeita!
ACT_1_7.1,"Anyway, about my first memory.","Enfim, sobre minha primeira memória."
ACT_1_7.2,"My first ever memory was from when I briefly visited my now deceased grandfather's house in the [i]Seoking[/i] village, in the state of [i]Tarimata[/i], which then lay on the borders of the former nation of [i]Conferri[/i].","Minha primeira memória foi de quando eu brevemente visitara a casa do meu finado avô na vila de [i]Seoking[/i], no estado de [i]Tarimata[/i], que na época ficava na fronteira da antiga nação de [i]Conferri[/i]."
ACT_1_7.3,"My grandfather used to say that the village served as a border itself, and at some point, while there were no fences, tombstones, or soldiers to divide the area,","Meu avô costumava dizer que a vila servia como a própria fronteira, e em alguns momentos, apesar de não haver certas, túmulos, ou soldados para dividir a área,"
ACT_1_7.4,there were only two wide flags that flowed around with the strong winds that blew them.,haviam apenas duas grandes bandeiras que sacudiam com os fortes ventos que sopravam nelas.
ACT_1_7.5,"My first memory, you see, is of that blue flag of [i]Conferri[/i] falling to the ground,","Minha primeira memória, sabe, é daquela bandeira azul de [i]Conferri[/i] caindo no chão,"
ACT_1_7.6,"because in the war of unification,","porque na guerra de unificação,"
ACT_1_7.7,the only flag that remained standing was of my nation.,a única bandeira que restara de pé foi a da minha nação.
ACT_1_8.1,"I still remember the yellow sky above, and the sun shining so brightly.","Eu ainda me lembro do céu amarelo acima, e do sol brilhando intensamente."
ACT_1_8.2,"I still remember the black smokes of victory,","Ainda me lembro da fumaça negra da vitória,"
ACT_1_8.3,as the once lost nation of [i]Conferri[/i] found its way back to its motherland and unified in its care.,enquanto a outrora perdida nação de [i]Conferri[/i] encontrara seu caminho de volta à pátria mãe e fora unificada sob seus cuidados.
ACT_1_8.4,Buildings and houses that were made of straws and poor cements burned in the fire of reinvention.,Prédios e casas feitos de palha e cimento ruim queimaram nas chamas da reinvenção.
ACT_1_8.5,"Three years later, like a phoenix, those places rose to prominence, as now right there stands a museum of our history, in its shiny new marble walls, whose each square inch glitter against both the strong rays of our father sun, and the gentle white blanket of mother moon.","Três anos depois, como uma fênix, aqueles lugares ganharam proeminência, pois agora lá se encontram um museu de nossa história, e em suas novas paredes de mármore brilhante, em que cada centímetro quadrado brilha contra os raios brilhantes de nosso pai sol, e contra o gentil cobertor branco da mãe lua."
ACT_1_9.1,"So yeah,","Então é,"
ACT_1_9.2,"my first memory is of the flag of an already declining nation falling,","minha primeira memória é da bandeira de uma nação em declínio caindo,"
ACT_1_9.3,"and my flag standing still proudly. Our nation was united once again, as it were before the reign of [i]Hindaravs[/i].","e minha bandeira de pé orgulhosamente. Nossa nação estava unida novamente, assim como antes do reino dos [i]Hindarav[/i]."
ACT_1_10.1,"Even though my grandfather is long dead,","Mesmo que meu avô esteja há muito morto,"
ACT_1_10.2,I still visit my village from time to time for two activities.,eu ainda visito sua vila de vez em quando para duas atividades.
ACT_1_10.3,"To pay respects to the grave of my now departed Grandpa, Souka Isidro,","Prestar respeito ao túmulo do meu agora finado avô, Souka Isidro,"
ACT_1_10.4,and to salute the flag that has made me the bold man that I am today.,e saudar a bandeira que me tornou o homem corajoso que sou hoje.
ACT_1_10.5,"It has been twenty years since the unification, and while the red sun...may fall against the evening melodies,","Já se passaram vinte anos desde a unificação, e enquanto o sol vermelho... Pode cair contra as melodias noturnas,"
ACT_1_10.6,the red flag stands against the rough and tear of unpredictable weather and flows boldly.,a bandeira vermelha se mantém contra a depredação e desgaste do tempo imprevisível e voa corajosamente.
ACT_1_11.1,"My apologies, I might have gone on a tangent again.","Perdão, eu posso ter mudado de assunto novamente."
ACT_1_11.2,"You see, I love my country, as any person instilled with great values would.","Sabe, eu amo meu país, assim como qualquer pessoa que aprendera grandes valores."
ACT_1_11.3,"But still, it looks like my country will never know of my dedication, and it isn't my motherland's fault. For you see, I am about to tell you a tale.","Mas ainda assim, parece que meu país nunca sabera de minha dedicação, e não é culpa de minha pátria mãe. Pois veja bem, eu irei contar-lhe um conto."
ACT_1_11.4,"A tale that will explain how I ended in this deep,","Um conto que explicará como que terminei nesse profundo,"
ACT_1_11.5,"dark,","sombrio,"
ACT_1_11.6,"and empty space,","e vazio lugar,"
ACT_1_11.7,whose corners and skies are impossible to find.,cujos cantos e céus são impossíveis de encontrar.
ACT_1_12.1,"A tale of the injustice that was done to me, my wife, and my son, by the enemies of the motherland.","Um conto da injustiça feita contra mim, minha esposa, e meu filho, pelos inimigos da pátria mãe."
ACT_1_12.2,"When it all ends,","Quando tudo terminar,"
ACT_1_12.3,I am pretty sure that you ...,tenho certeza que você...
ACT_1_12.4,"the new or already existing loyal child of mother [i]Yhafa[/i] (and do not worry, for mother [i]Yhafa[/i]'s arms are open to all, so feel free to join) ...","a nova ou recém chegada criança leal da mãe [i]Yhafa[/i] (e não se preocupe, pois os braços da mãe [i]Yhafa[/i] estão abertos a todos, então sinta-se livre para se juntar a nós)..."
ACT_1_12.5,"would agree, that, whatever happened to me and the ones I loved, is a great injustice.","concordaria que, o que quer que tenha acontecido a mim e àqueles que eu amo, é uma grande injustiça."
ACT_1_12.6,I cannot tell the nature of this injustice...,Não posso te contar a natureza dessa injustiça...
ACT_1_13.1,"...or what caused it, but you know it to be true.","...ou o que a causou, mas eu sei que é a verdade."
ACT_1_13.2,"A family that is as dedicated to god as it is dedicated to the country, clearly deserved better.",Uma família dedicada tanto a deus quanto ao país claramente merece algo melhor.
ACT_1_13.3,"However, what can anyone do when tragedy strikes?","Entretanto, o que é possível fazer quando a tragédia acontece?"
ACT_1_13.4,For when disturbed forces,Pois quando forças perturbadas
ACT_1_13.5,"(that is, the people who refuse any help to control the chaos inside them, which allows discipline to abandon their minds)","(ou seja, pessoas que recusam qualquer ajuda para controlar o caos dentro de si, o que permite que a disciplina abandone suas mentes)"
ACT_1_13.6,"let their lack of direction lead to chaos and traitorous activities,","deixam sua falta de direção levar ao caos e a atos traiçoeiros,"
ACT_1_13.7,then it is the innocent and well-bled people like us who bite the bullet.,então são as pessoas inocentes e de bom coração como nós que pagamos o preço.
ACT_1_14.1,"Sorry, I let myself rant again.","Desculpe, eu comecei a reclamar novamente."
ACT_1_14.2,So foolish of me.,Que tolice a minha.
ACT_1_14.3,I apologize for my disturbing and incoherent ramblings.,Peço perdão pelas minhas reclamações perturbadoras e incoerentes.
ACT_1_14.4,"I did not wish to waste your time like this, but....","Não desejo desperdiçar seu tempo assim, mas..."
ACT_1_14.5,what can we do...,O que podemos fazer...
ACT_1_14.6,emotions aren't a straight stream of a river you know...,"Emoções não são o fluxo reto de um rio, sabe..."
ACT_1_15.1,"And even if you are some hidden spy of those who still believe that [i]Conferri[/i] would ever be a thing again,","E mesmo que você seja um espião escondido daqueles que acreditam que [i]Conferri[/i] possa voltar a ser algo novamente,"
ACT_1_15.2,"you will agree that it is a just simile to say that emotions are like rain, when they are released, they fall everywhere and anywhere.","você há de concordar que emoções são como a chuva, e quando são liberadas, caem sobre tudo e todos."
ACT_1_16.1,He. He. He. He. He.,He. He. He. He. He.
ACT_1_16.2,He. He. He. He. He. He.,He. He. He. He. He. He.
ACT_1_16.3,He. He. He. He. He. He.,He. He. He. He. He. He.
ACT_1_17.1,"Sorry,","Desculpe,"
ACT_1_17.2,it is just so funny.,é que é tão engraçado.
ACT_1_17.3,"If our great warriors were nearby,","Se nossos grandes guerreiros estivessem próximos,"
ACT_1_17.4,they would laugh at me for my signs of weakness.....,eles iriam rir de mim por meus sinais de fraqueza...
ACT_1_17.5,"well, I guess that's why it happened to me...","Bem, acho que isso aconteceu comigo..."
ACT_1_18.1,I-It happened to me...,A-aconteceu comigo...
ACT_1_19.1,[color=red]Because I was weak.[/color],[color=red]Porque eu fui fraco.[/color]
ACT_1_20.1,"As far as I can remember,","Pelo que eu consigo lembrar,"
ACT_1_20.2,it was probably a cloudy day.,provavelmente era um dia nublado.
ACT_1_20.3,"I can't say that with full confidence, because the office that was provided to me was severely malnourished when it came to lighting.","Não consigo dizer com total confiança, porque o escritório que me fora providenciado era severamente deficiente em questão de iluminação."
ACT_1_20.4,"It was not as if light never seeped inside, but the amount was so low that you couldn't accurately tell what was actually happening with the sky.","Não era como se a luz nunca conseguisse entrar, mas a quantidade era tão pequena que você não conseguia dizer com precisão o que estava de fato acontecendo com o céu."
ACT_1_20.5,"You could very well see yellow rays of light seeping in, only to find the weather outside to be all grey, and only some small miraculous clouds drift above,","Você podia muito bem ver raios amarelos de luz entrando, apenas para descobrir que o tempo lá fora estava todo cinza, e apenas algumas pequenas nuvens milagrosas voavam acima,"
ACT_1_20.6,letting a few escaping rays of light into the office.,deixando escapar alguns raios de luz para dentro do escritório.
ACT_1_21.1,"And for the past three days I was basically locked inside,","E pelos últimos três dias eu estava basicamente trancado lá dentro,"
ACT_1_21.2,having eaten or drunk very little and being in a constant state of panic from start to end.,tendo comido ou bebido muito pouco e estando em um constante estado de pânico do começo ao fim.
ACT_1_22.1,"The thing was that for the past four days,","O que acontecia era que durante os últimos quatro dias,"
ACT_1_22.2,"near the [i]Ufana[/i] prefecture in Division 6 outpost,","perto da prefeitura de [i]Ufana[/i] no posto da Divisão 6,"
ACT_1_22.3,student rallies suddenly erupted.,protestos estudantis tiveram início.
ACT_1_22.4,"At first, it was just a few pro-[i]Conferri[/i] students forming a union to demonstrate and shout for their supposed-freedom.","No começo, eram apenas alguns estudantes pró-[i]Conferri[/i] formando um sindicato para demonstrar e gritar por sua suposta liberdade."
ACT_1_22.5,"From what I understand, the demonstration area was secured by fraud, as the students pretended to ask the area permission for a play that they had prepared in honor of our leader, however, when blue banners, microphones, and chants of 'Free us! Free us!' started to surround the area, the authorities realized that something was wrong.","Pelo que entendi, a área de demonstração fora adquirida por fraude, pois os estudantes fingiram pedir a permissão da área para uma peça que haviam preparado em honra a nosso líder, entretanto, quando bandeiras azuis, microfones, e cânticos de 'Nos liberte! Nos liberte!' começaram a cercar a área, as autoridades perceberam que havia algo errado."
ACT_1_23.1,"'Sorry, am I hearing this correctly?","'Desculpe, estou ouvindo isso corretamente?"
ACT_1_23.2,Did you ask for a transfer of 19 soldiers to [i]Ufana[/i] prefecture or 90?',Você pediu a transferência de 9 soldados para a prefeitura de [i]Ufana[/i] ou de 90?'
ACT_1_23.3,My hands gripped the receiver of the telephone tightly.,Minhas mãos agarraram o telefone com força.
ACT_1_23.4,"Sweat was trickling down my body, as the last drop of water that I had not so long ago evaporated from my throat.","Suor escorria por meu corpo, enquanto a última gota de água que eu bebera há não muito tempo evaporava de minha garganta."
ACT_1_23.5,"I was taking dry gulps, for I had no more saliva to produce inside my body.","Eu estava engolindo em seco, pois eu não tinha mais saliva para produzir no meu corpo."
ACT_1_24.1,'90! 90!','90! 90!'
ACT_1_24.2,The angry voice on the other side replied.,A voz raivosa no outro lado respondeu.
ACT_1_25.1,'How did it come to 90?! I...COFF...COFF...COFFF...','Como chegou a 90?! Eu... COFF... COFF... COFF...'
ACT_1_25.2,Three small coughs escaped my mouth.,Três pequenas tosses escaparam de minha boca.
ACT_1_25.3,They were dry.,Estavam secas.
ACT_1_25.4,I could almost feel the skin inside my throat itching with god knows how many smaller red swollen spots growing from a lack of hydration.,Eu quase conseguia sentir a pele dentro da minha garganta coçando com deus sabe lá quantos pontinhos vermelhos inchados crescendo pela falta de hidratação.
ACT_1_26.1,'Rikki! You said you would have it handled by yesterday.,'Rikki! Você disse que teria resolvido tudo até ontem.
ACT_1_26.2,It has been 24 hours since yesterday!,Já se passaram 24 horas desde ontem!
ACT_1_26.3,"It's not yesterday anymore, it is today now! Do you have any idea the scolding I am going to get from the general?!'","Não é mais ontem, agora é hoje! Tem noção da bronca que eu vou levar do general?!'"
ACT_1_27.1,"'Look,' Rikki's voice was frustrated on the other side, 'If you weren't a personal friend and your wife wasn't a midwife to mine, I would've ordered your brains bashed with a brick right now.","'Olha,' a voz de Rikki estava frustrada no outro lado, 'Se você não fosse um amigo próximo e sua mulher parteira da minha, eu já teria ordenado que seu cérebro fosse esmagado com um tijolo."
ACT_1_27.2,You understand that?!,Você entendeu?!
ACT_1_27.3,I am already maxed out on handing shit here!,Eu já estou no limite pra aturar merdas aqui!
ACT_1_27.4,The last thing I wish to hear is your pathetic screaming!,A última coisa que eu quero ouvir são seus gritos patéticos!
ACT_1_27.5,DO YOU UNDERSTAND THAT?!',VOCÊ ENTENDEU?!'
ACT_1_28.1,"'I-I....coff...' a small, weak cough escaped from a man who was reminded of both his position and privilege.",'E-eu... coff...' uma tosse pequena e fraca escapou de um homem que fora lembrando de sua posição e privilégio.
ACT_1_28.2,"Still, humbleness never hydrated anyone's throat or took away anyone's nausea.","Ainda assim, a humildade nunca hidratara a garganta de ninguém ou acabara com a náusea de ninguém."
ACT_1_28.3,My voice was still going to sound rough and scream all the same.,Minha voz ainda soaria áspera da mesma maneira.
ACT_1_28.4,"I stressed hard on my throat again, trying my best at clearing it somehow, so my voice could be more prim and proper.","Eu forcei a garganta novamente, tentando ao máximo limpá-la de alguma forma, para que minha voz ficasse mais respeitável e elegante."
ACT_1_28.5,"However, all that escaped from me was more coughing.","Entretanto, tudo o que escapou de mim foram mais tosses."
ACT_1_29.1,'Ronan! You there...' Rikki's voice reverberated from the telephone.,'Ronan! Você tá...' a voz de Rikki reverberou do telefone.
ACT_1_29.2,"I was so stressed out that every time Rikki said anything, the voice came inside my ears like nails on a chalkboard.","Eu estava tão estressado que sempre que Rikki dizia algo, a voz entrava em meus ouvidos como unhas em um quadro negro."
ACT_1_29.3,My body at that time had a lot of demands that circumstances weren't allowing to be full-filled.,Meu corpo naquele momento tinha muitas demandas que as circunstâncias não permitiam serem atendidas.
ACT_1_30.1,My mind wished for peace.,Minha mente desejava paz.
ACT_1_31.1,My throat wished for water.,Minha garganta desejava água.
