keys,en,pt_BR
ACT_1_92.3,"'Well, what happened was that they didn't count on the doctor being shot. The idiot had his head poking out the window, so I ordered the sniper to take a shot. They threw a grenade in retaliation, but thankfully only four soldiers died from it. The rest cleared the area quickly. When the counter-terrorist group arrived, the very first thing they noticed was one of the student union leaders and the girl trying to escape. Apparently, this girl, who also happens to be one of the union leaders, and just 16 I tell you, is pregnant with her classmate's child. The classmate probably died earlier or something, because we interrogated the girl just now, and she said that the father died long ago. The union...COFF...the union leader looked like some ugly pig anyway, and the girl is one of those princess looking types I tell you, so I don't think it is a lie. Can't imagine that piggish bastard putting anything inside her. He-he.'\n\n",ACT_1_92.3_PT
ACT_1_92.4,I could hear him putting tobacco in his mouth and chewing.,ACT_1_92.4_PT
ACT_1_92.5,That noise of his chewing was always painful to my ears.,ACT_1_92.5_PT
ACT_1_93.1,"'So, it was simple.",ACT_1_93.1_PT
ACT_1_93.2,"All the soldier had to do was point a gun at her stomach, and the pig showed where they had their comms set up.",ACT_1_93.2_PT
ACT_1_93.3,"Soon enough, we blew up that building, and everyone around started panicking, not knowing what happened.",ACT_1_93.3_PT
ACT_1_93.4,"Then it was just blasting one or two buildings, and every mouse in the hole started to climb out in spades,'",ACT_1_93.4_PT
ACT_1_93.5,"around this part I heard a slight, subtle, but very noticeable gulp from him, maybe it was just from that chewing habit of his, I never inquired it,",ACT_1_93.5_PT
ACT_1_93.6,'Then it was just shooting and taking prisoners.,ACT_1_93.6_PT
ACT_1_93.7,Many surrendered and many didn't.,ACT_1_93.7_PT
ACT_1_93.8,"You know the course of what happened. But seriously, this was a headache just a while ago, but now it wrapped up smoothly. He-He.'",ACT_1_93.8_PT
ACT_1_94.1,"'Sir, you said....' I leaned forward on my chair, 'that you wish to broadcast something live to me. What is it?'",ACT_1_94.1_PT
ACT_1_95.1,"'Have an appointment with an ear doctor after this one. Choose a civil one instead of an army one, most of those jerk just fuck around. I showed one of them a decayed tooth of mine, and that walnut-brain idiot was talking about uprooting it. It was only the civil one who suggested a bloody root canal. These aren't my baby teeth you know, once they are uprooted, it's done, nothing, nada. If I had gone with the...army doctor, I would be wearing dentures now.'",ACT_1_95.1_PT
ACT_1_95.2,"As chuckle-hearty he was throughout saying that, all I could imagine of him was a serious face and those eyes that always seemed to stare at something that was not there.\n\n",ACT_1_95.2_PT
ACT_1_95.3,I will make this story quick.,ACT_1_95.3_PT
ACT_1_95.4,"We were bunk-mates in the training academy as well. There, I once woke up in the middle of the night after a terrible dream that I cannot recall, but I heard him mumble the word,",ACT_1_95.4_PT
ACT_1_95.5,[b]'Chio'[/b],ACT_1_95.5_PT
ACT_1_95.6,again and again in his sleep....Saying that word always brought a genuine smile on his face.\n\n,ACT_1_95.6_PT
ACT_1_95.7,"Remembering that I wished I was there with him, physical in person. Just so I could see a new version of his old smile that I last saw in training.",ACT_1_95.7_PT
ACT_1_96.1,"'Anyway,' He gathered his breath and I heard him gulp down water.",ACT_1_96.1_PT
ACT_1_96.2,"Then with a calmer tone he said, 'We have that pregnant girl and some other scum-fucks lined outside to be shot.",ACT_1_96.2_PT
ACT_1_96.3,"We have two leaders on the torture blocks, it will take just a few more minutes and they will eventually blurt up where they got the hand-grenades from, and how they managed to blow up the tank,'",ACT_1_96.3_PT
ACT_1_96.4,"a sigh came from his end,",ACT_1_96.4_PT
ACT_1_96.5,'we will be beginning soon.'\n\n,ACT_1_96.5_PT
ACT_1_96.6,"'I would recommend you halt for a while,'",ACT_1_96.6_PT
ACT_1_96.7,"I spoke quickly, 'considering the girl is pregnant... I might need to ask the general about it.'\n\n",ACT_1_96.7_PT
ACT_1_96.8,"'Well,' Rikki didn't seem protesting, it felt like he knew what the general's ultimate answer would be, 'but you better talk to him quick, for we will halt for five minutes. And after five minutes, nobody knows if someone's hand slips on a trigg...' his chuckles disappeared for a while and he gulped more water and inhaled small breaths, and then resuming that chuckles of his he continued, 'trigger you know. He-He. Oh, Yukio! Just in time. That scotch looks very fine.'",ACT_1_96.8_PT
ACT_1_97.1,"I wanted to make sure this went by the book, and also...",ACT_1_97.1_PT
ACT_1_98.1,....,ACT_1_98.1_PT
ACT_1_99.1,Something about the word 'pregnant' made me think of her.,ACT_1_99.1_PT
ACT_1_100.1,"'Yeah, kill the little bitch,'",ACT_1_100.1_PT
ACT_1_100.2,"I heard the general chuckle from the other side as he dripped some of the wine on his glass,",ACT_1_100.2_PT
ACT_1_100.3,'both the parents are like weeds on a cultivated land. There...s no way that two weeds could ever sprout a flower.',ACT_1_100.3_PT
ACT_1_100.4,"I heard him gulp his wine a little more,",ACT_1_100.4_PT
ACT_1_100.5,"'And by the way, I got the leave request that you forwarded through Captain Rikki. He speaks highly of how you handled the situation. I must agree with him, your quick communication has saved us a lot of time, and spared many people's heads from getting cut...ha-ha, including mine. You have earned your free time officer.'\n\n",ACT_1_100.5_PT
ACT_1_100.6,"'Thank you sir,' I spoke in a low voice, still not sure if it was proper for me to smile again.",ACT_1_100.6_PT
ACT_1_100.7,Something still felt weird.,ACT_1_100.7_PT
ACT_1_101.1,"'Anyway, forward this last order from me, until your child's birth, that is, we will be needing you back in the field soon. To Captain Rikki, tell him to kill the bitch unless she has anything important to squeak.'\n\n",ACT_1_101.1_PT
ACT_1_101.2,"'Yes, sir.' I spoke calmly, and the general cut my call.\n\n",ACT_1_101.2_PT
ACT_1_101.3,"All that was left, was to contact Rikki himself.",ACT_1_101.3_PT
ACT_1_102.1,"'Don't say anything,'",ACT_1_102.1_PT
ACT_1_102.2,"Rikki said from the otherside, 'if the general for some reason said no, let me know, otherwise, stay silent and listen.'\n\n",ACT_1_102.2_PT
ACT_1_102.3,"I held the receiver tight, and though there were things I wished to talk with Rikki, mainly if the girl had any vital information to give, but my lips remained sealed till the end.",ACT_1_102.3_PT
LAST_DISCLAIMER,"Last Disclaimer: The following scene, while not containing anything sexual or gorey, may still be too disturbing for some players to read. It is advised to take a break if things get tough to read. If you wish to skip the scene in its entirety, just press fast forward until the words 'ACT TWO' appear on the screen.",LAST_DISCLAIMER_PT
ACT_1_103.1,I heard distant but clear voices of soldiers cackling and people crying.,ACT_1_103.1_PT
ACT_1_103.2,"The closest one was that of the girl weeping. I didn't even have to speculate for long if it was the same girl that was at the centre of the discussion, for soon a soldier laughed,",ACT_1_103.2_PT
ACT_1_103.3,"'Damn, if the father was alive I could've asked her if she gave a good hand. Say miss, do you give a good hand?'\n\n",ACT_1_103.3_PT
ACT_1_103.4,"Then another said,",ACT_1_103.4_PT
ACT_1_103.5,"'She is a [i]Conferri[/i] of course she does. No wonder the princess got the boy...sorry, sorry, I mean THE MAN to put a baby in her. She obviously did a little CQC on him...'\n\n",ACT_1_103.5_PT
ACT_1_103.6,'You missed a good moment to say hand-to-hand combat.' Another chuckled as he reloaded his gun.,ACT_1_103.6_PT
ACT_1_103.7,The girl's weeps were getting louder.,ACT_1_103.7_PT
ACT_1_103.8,"Something in my mind told me to put down the receiver, but my hands and ears didn't obey.\n\n",ACT_1_103.8_PT
ACT_1_103.9,"The girl's cries got worse, maybe it was then that probably another student of the union said in anger,",ACT_1_103.9_PT
ACT_1_103.10,'Don't you touch her!'\n\n,ACT_1_103.10_PT
ACT_1_103.11,To which all chuckled.,ACT_1_103.11_PT
ACT_1_104.1,"'You the godfather of the little guy? Was your friend or brother by any means the child...s father? I mean you can't be the father yourself, have you looked at your face. No way a girl like that would be fucking you, any other guy, and we would've started suspecting if little princess lied to us about the father being dead. But you fatso, no chance.'",ACT_1_104.1_PT
ACT_1_104.2,"Three more men chuckled at this ... two strong chuckles, and one weak,",ACT_1_104.2_PT
ACT_1_104.3,"'You know my child could use a godfather as well. The application's open, what do you say little piggy, wanna apply?'",ACT_1_104.3_PT
ACT_1_104.4,Three pats on the shoulder.,ACT_1_104.4_PT
ACT_1_104.5,"Now whether it was the mockers patting the mocked, or someone congratulating the guy for his stand-up routine, I couldn't tell.",ACT_1_104.5_PT
ACT_1_104.6,All little noises at that moment seemed to merge into one.,ACT_1_104.6_PT
ACT_1_105.1,"A woman's voice suddenly spoke,",ACT_1_105.1_PT
ACT_1_105.2,"'Please, let her go, she is just a,'",ACT_1_105.2_PT
ACT_1_105.3,and was silenced by three bullets before she could even finish speaking.,ACT_1_105.3_PT
ACT_1_105.4,"The girl wept badly, the fat kid grunted in anger, and the rest, whether students or adults, were all panicking.",ACT_1_105.4_PT
ACT_1_105.5,"Some crying,",ACT_1_105.5_PT
ACT_1_105.6,"some pleading,",ACT_1_105.6_PT
ACT_1_105.7,and the others having all sorts of breakdowns of their own.,ACT_1_105.7_PT
ACT_1_106.1,"'Aye, aye, look,' A soldier spoke,",ACT_1_106.1_PT
ACT_1_106.2,"'Some of her hair has gone white. I swear to god I didn't remember them being that white two hours before. Damn, miss, are you somehow an old woman? A witch perhaps?'\n\n",ACT_1_106.2_PT
ACT_1_106.3,"'Ginta you idiot, it is that white hair thing I told you about, you weren't listening, were you?' Another voice chuckled and then three more shots reverberated in the air.",ACT_1_106.3_PT
ACT_1_106.4,Someone else had fallen dead.\n\n,ACT_1_106.4_PT
ACT_1_106.5,"'My bad, my bad. You are so boring you know, when you talk about the fun facts you read in Ritley's or something. News flash asshole, nobody in a seven mile radius cares.'",ACT_1_106.5_PT
ACT_1_106.6,"Four more chuckles, one more bullets, somewhere a body fell, somewhere a bird flew away scared.",ACT_1_106.6_PT
ACT_1_107.1,"'Anyway, don't worry miss, we won't touch ya. We are god fearing men, we are good men. You can trust us! We don't touch a pregnant lady. I don't know about you [i]Conferri[/i] fellas, but we know better than to touch one who is not ours, no matter how good-looking you can be. Which is a shame, because miss, I tell you, if you wanted to be an adult that soon, you could have walked to me, right by [i]Senbi[/i] prefecture. I do guards duty all day there, and could have used a hand for help. He-he.'\n\n",ACT_1_107.1_PT
ACT_1_107.2,"At this point the fat kid tried to rush towards him screaming, 'You fuckin,'",ACT_1_107.2_PT
ACT_1_107.3,but a simple kick pushed him down to his place again.,ACT_1_107.3_PT
ACT_1_108.1,"'Well, well,' Another one spoke, no...maybe it was the same guy.",ACT_1_108.1_PT
ACT_1_108.2,"I could not tell, every voice was the same,",ACT_1_108.2_PT
ACT_1_108.3,'We underestimated the godfather when we said that he was a piggy.,ACT_1_108.3_PT
ACT_1_108.4,This guy's a boar!,ACT_1_108.4_PT
ACT_1_108.5,A WILD BOAR!,ACT_1_108.5_PT
ACT_1_108.6,HUA!,ACT_1_108.6_PT
ACT_1_108.7,Look out he will tackle us with his tusks!',ACT_1_108.7_PT
ACT_1_108.8,"Everyone laughed, or at least it felt like it. For any weep or cry was buried inside the sound of ever chanting laughter.\n\n",ACT_1_108.8_PT
ACT_1_108.9,"It seemed funny, but for some reason, my lips remained sealed.",ACT_1_108.9_PT
ACT_1_108.10,"Maybe if I told Rikki this, he would say that I needed to restructure my humor a little bit, because I heard him chuckle a little as well.",ACT_1_108.10_PT
ACT_1_108.11,"I mean, I believe it was him, but it could...ve been the soldier standing near him.",ACT_1_108.11_PT
ACT_1_108.12,Still I am pretty sure he liked jokes like these.,ACT_1_108.12_PT
ACT_1_108.13,"So it was most possibly him laughing, thinking this was the funniest joke he ever heard.",ACT_1_108.13_PT
ACT_1_109.1,"'Grunt for us, please. I implore you, we all need to hear the roar of the actual MAN here.",ACT_1_109.1_PT
ACT_1_109.2,"Man who is thirty kilograms more than he needs to be, but a MAN nonetheless.",ACT_1_109.2_PT
ACT_1_109.3,"Please, roar for us.",ACT_1_109.3_PT
ACT_1_109.4,"I implore you, we might spare you if you do,'",ACT_1_109.4_PT
ACT_1_109.5,"everyone chuckled, but he didn't roar.\n\n",ACT_1_109.5_PT
ACT_1_109.6,"'Oh, I get it. Nobel man you are. Sir, I salute you.' I heard feet stomping, just from the noise I could tell that it was a perfect salute.\n\n",ACT_1_109.6_PT
ACT_1_109.7,"Laughter reverberated again. I tried searching for the weeps that would surface when there was no laughter, but they were LOUD. Very, very, loud.",ACT_1_109.7_PT
ACT_1_110.1,"'Okay, my nobel sir, what if I tell you I will spare the little princess. Would you roar for us then?'\n\n",ACT_1_110.1_PT
ACT_1_110.2,"Suddenly, every noise stopped. Laughters and weeps all subsided to silence, everyone was in anticipation. Some out of hope, that at least one of them would be spared.",ACT_1_110.2_PT
ACT_1_110.3,"Some out of curiosity,",ACT_1_110.3_PT
ACT_1_110.4,waiting for the punchline to a joke.\n\n,ACT_1_110.4_PT
ACT_1_110.5,"'P-please, h-he-he-her water could break anytime,'  the kid pleaded, and a small squeak escaped the girl.\n\n",ACT_1_110.5_PT
ACT_1_110.6,"'Ooooo,' multiple soldiers chanted like school boys. Some chuckled as well.\n\n",ACT_1_110.6_PT
ACT_1_110.7,"'Well staying hydrated is good lads, but I ain't drinking that one,' someone joked, everyone chuckled.",ACT_1_110.7_PT
ACT_1_111.1,'Roar...' The man simply spoke.\n\n,ACT_1_111.1_PT
ACT_1_111.2,"'Ginta I think that's enough,'",ACT_1_111.2_PT
ACT_1_111.3,A voice from the soldier...s side said.,ACT_1_111.3_PT
ACT_1_111.4,"From the voice, it sounded like he had to muster a lot of courage to say that, 'I still say we take them prisoners, it is....'\n\n",ACT_1_111.4_PT
ACT_1_111.5,"'Yukio, show mister by-the-book the exit please. This is a gentlemen's club, not for little squealers.'\n\n",ACT_1_111.5_PT
ACT_1_111.6,"'Ginta, this could bring us troub...'",ACT_1_111.6_PT
ACT_1_111.7,"Before this 'squealer' could say anything, a hand patted his shoulder, and a voice spoke,",ACT_1_111.7_PT
ACT_1_111.8,'These are the general's order. He ordered a little entertainment. You wish to defy orders.'\n\n,ACT_1_111.8_PT
ACT_1_111.9,There was no reply.\n\n,ACT_1_111.9_PT
ACT_1_111.10,"'Good man,' The voice patted him on the shoulder again, and the person walked back three steps.",ACT_1_111.10_PT
ACT_1_112.1,"'Now, where were we, yes, roar please...'",ACT_1_112.1_PT
ACT_1_112.2,"The man, whose name I had learned by now was Ginta, clapped his hands in excitement.\n\n",ACT_1_112.2_PT
ACT_1_112.3,"Silence remained, except for the few bursts of cries that escaped the girl. Every time she did, I could make out exactly how her throat was breaking in two.\n\n",ACT_1_112.3_PT
ACT_1_112.4,"'Fellas,' announced Ginta, 'He needs a little encouragement. So, boys he could use some chants. On a count of three, we will cheer him up.",ACT_1_112.4_PT
ACT_1_112.5,One.,ACT_1_112.5_PT
ACT_1_112.6,Two.,ACT_1_112.6_PT
ACT_1_112.7,Three!',ACT_1_112.7_PT
ACT_1_113.1,[color=red]ROAR! ROAR! ... ROAR! ... ROAR! ... ROAR! ... ROAR! ... ROAR! ... ROAR! ... ROAR! ... ROAR! ... ROAR! ... ROAR![/color],ACT_1_113.1_PT
ACT_1_114.1,"The chants reverberated so loud, that sometimes it felt like someone was standing behind me, also screaming",ACT_1_114.1_PT
ACT_1_114.2,ROAR.,ACT_1_114.2_PT
ACT_1_114.3,"Though most of them mixed with each other, I could not make out Rikki's voice between'them. I wish I could have screamed with them, had a joy of laughter, but somehow, my jaw moved not once.",ACT_1_114.3_PT
ACT_1_114.4,"Not once! Something was definitely wrong with me. I wonder if Kaede was here, she would see me as a less joyous man.",ACT_1_114.4_PT
ACT_1_114.5,"Would she be jealous that other men were so cheerful and yet, her own husband was silent as a statue.",ACT_1_114.5_PT
ACT_1_115.1,"'A...A...aaaaaaaa....ahhhhhh....ahh-ack...ahhh,' a low roar escaped the fat kid as he fought the tears that choked his throat.\n\n",ACT_1_115.1_PT
ACT_1_115.2,"'Come on, come on, a little louder please. That's not a boar's roar,' Ginta chuckled.\n\n",ACT_1_115.2_PT
ACT_1_115.3,"'Ginta, boars don't roar. They grunt.' Someone corrected him as they finished cleaning the rifle and took a shot. Another body fell on the ground.\n\n",ACT_1_115.3_PT
ACT_1_115.4,"'Oh my bad, still, let's use our imaginations. If boars and lions had a baby together, what would the noise sound like? We have an interest in science, you know, biology is my favorite subject. Won't you agree, miss?'\n\n",ACT_1_115.4_PT
ACT_1_115.5,"The girl didn't reply, she just wept.\n\n",ACT_1_115.5_PT
ACT_1_115.6,"'Anyway...' Ginta snapped his fingers, 'AHHHHHHHHHHHHH! AHHHHHHHHHHHHHHH! AOGAAAAAAAAAAAAAAAAAAAAAA!' everyone chuckled. 'That's how loud a roar is! Come on, give us that loud! Any less than that is a whimper.'",ACT_1_115.6_PT
ACT_1_116.1,What happened next...,ACT_1_116.1_PT
ACT_1_116.2,happened rather too quickly.,ACT_1_116.2_PT
ACT_1_116.3,"The soldier that had told Ginta to stop suddenly took three steps forward, and without any rhyme or reason, he shot him on the head. A loud noise echoed in the place.",ACT_1_116.3_PT
ACT_1_116.4,"The impact of the shot was loud enough to tell me it wasn't an AK or anything, it was probably a shotgun.",ACT_1_116.4_PT
ACT_1_116.5,"So Ginta's head was (most probably) blow off totally clean at that close a range, and his bare brain, was (probably) dripping out of his body.",ACT_1_116.5_PT
ACT_1_116.6,"Seeing that, the fat kid attempted a run, but was shot down.",ACT_1_116.6_PT
ACT_1_116.7,Followed by the soldier who shot Ginta being shot himself.,ACT_1_116.7_PT
ACT_1_116.8,"Two other people attempted to escape, but were immediately shot too.",ACT_1_116.8_PT
ACT_1_116.9,"From the whimpers I heard, only four remained, the girl and three other people,",ACT_1_116.9_PT
ACT_1_116.10,none of whom sounded like adults.,ACT_1_116.10_PT
ACT_1_117.1,"'Fuck, what just fucking happened?!' Rikki screamed and threw the receiver on the ground but forgot to cut the call, and before it could be answered, the girl started screaming as well, for the noise of something dripping covered it all.\n\n",ACT_1_117.1_PT
ACT_1_117.2,"'Shit she is,' one man screamed, and then suddenly, three shots from a revolver echoed in my ear. The girl's body flopped down on the ground.\n\n",ACT_1_117.2_PT
ACT_1_117.3,"'Fuck, shoot her belly as well! Her dead body can still give....'",ACT_1_117.3_PT
ACT_1_118.1,My hands somehow managed to do it.,ACT_1_118.1_PT
ACT_1_118.2,I had kept the receiver down.,ACT_1_118.2_PT
ACT_1_118.3,My ears were still ringing from all the shooting that happened.,ACT_1_118.3_PT
ACT_1_118.4,"In fact, I was still piecing together what had just happened.",ACT_1_118.4_PT
ACT_1_119.1,"The phone rang again, I was hesitant to pick it up, but my hands moved anyway, and the receiver was in my ears again.",ACT_1_119.1_PT
ACT_1_119.2,"I quietly picked it up, and put it to my ears, 'Hello.'\n\n",ACT_1_119.2_PT
ACT_1_119.3,"'Sir,' it was the junior, he was weeping.",ACT_1_119.3_PT
ACT_1_119.4,"I am pretty sure he was trying his best to not let his emotions overcome him, but it seemed what had happened was something so drastic that it was impossible for him to hold back his tears.",ACT_1_119.4_PT
ACT_1_120.1,"'Isamu...sir, h-h-he just di...' Isamu had died, that much was clear.",ACT_1_120.1_PT
ACT_1_120.2,"It was a shame to be honest, the man seemed healthy for a sixty year fellow, he could have still given ten more years to the motherland's service.",ACT_1_120.2_PT
ACT_1_120.3,"It was a shame,",ACT_1_120.3_PT
ACT_1_120.4,real shame.,ACT_1_120.4_PT
ACT_1_121.1,"'Well, here is a thing you can do,'",ACT_1_121.1_PT
ACT_1_121.2,"My voice was still, calm, and robotic.",ACT_1_121.2_PT
ACT_1_121.3,It surprised even me how calm it was.,ACT_1_121.3_PT
ACT_1_121.4,"From what I had just heard, something in my mind told me that I needed to be shaking and stuttering from fear,",ACT_1_121.4_PT
ACT_1_121.5,"'I know how close Isamu was to you, and so to the rest of us. We don't want his death to be counted as dishonor. So tell Seiko to make up a story that she was on her way to post some important documents when she was cornered by three [i]Conferri[/i] men, who tried to take her honor away. It was then that our brave Isamu stepped in, and while he was able to save her honor, in the scuffle, one of the [i]Conferri[/i] men shot him.",ACT_1_121.5_PT
ACT_1_121.6,"Now, make sure to put a bullet in Isamu's body, and instead of shooting straight at his chest, touch the gun to his diaphragm at a slanted angle and pull the trigger.",ACT_1_121.6_PT
ACT_1_121.7,It will look random that way.,ACT_1_121.7_PT
ACT_1_121.8,"So, we have a story here that will give Isamu an....",ACT_1_121.8_PT
ACT_1_122.1,[color=red]'...an honorable burial.'[/color],ACT_1_122.1_PT
ACT_1_123.1,"'Well, that is all I can do to help. I am sorry for your loss.'\n\n",ACT_1_123.1_PT
ACT_1_123.2,"I wanted to put down the phone immediately, but I stuck around to hear the junior say in a genuinely grateful voice,",ACT_1_123.2_PT
ACT_1_123.3,'Thank you sir.',ACT_1_123.3_PT
ACT_1_124.1,"I kept the phone down, and stared at the ceiling.",ACT_1_124.1_PT
ACT_1_124.2,The screams of the girl and the pleas of the fat kid were still in my mind.,ACT_1_124.2_PT
ACT_1_124.3,"It was hard to keep my eyes open, and so...",ACT_1_124.3_PT
ACT_1_125.1,...I closed them.,ACT_1_125.1_PT
ACT_1_126.1,And dreamt of getting back to her.,ACT_1_126.1_PT
