keys,en,pt_BR
ACT_1_61.2,"I don't know which one was left and which one was right and at this point, I didn't even know what was half of my body doing half the time.","Eu não sabia mais qual era a direita e qual era a esquerda, e nem mesmo sabia o que metade do meu corpo estava fazendo metade das vezes."
ACT_1_61.3,It was basically running on auto-pilot.,Ele basicamente estava funcionando no piloto-automático.
ACT_1_62.1,Tring. Tring.,Tring. Tring.
ACT_1_63.1,"The line on the other side kept ringing, and my ears remained fixated.","A linha no outro lado continuou tocando, e meus ouvidos continuaram fixos."
ACT_1_63.2,"Even though I knew what the general was probably going to say, I wanted him to just pick it up, shout at me, give me orders, and get over it.","Mesmo que eu soubesse o que o general provavelmente diria, eu queria que ele atendesse, gritasse comigo, me desse uma ordem, e acabasse com isso logo."
ACT_1_63.3,"The longer the line on the other side rang, the longer my heart raced.","Quanto mais tempo a linha no outro lado chamava, mais rápido meu coração batia."
ACT_1_64.1,At this point I felt like it was going to stop at any moment.,A essa altura eu sentia que ele podia parar a qualquer momento.
ACT_1_65.1,'Love to [i]Yhafa[/i]!','Amor a [i]Yhafa[/i]!'
ACT_1_65.2,"A female voice chanted on the other side, it was a little rough and cranky, if one of my wife's friend's voices didn't sound exactly similar, I would've thought that someone put a 14-year-old boy on the other side.","Uma voz feminina entoou do outro lado, um pouco áspera e ranzinza, se a voz de uma das amigas de minha esposa não soasse exatamente similar, eu acharia que alguém colocara um garoto de 14 anos de idade do outro lado."
ACT_1_65.3,"Still, listening to a womanly voice like hers, made me want to go home to my wife again.","Ainda assim, ouvir uma voz feminina como a dela, me fez querer voltar para casa para a minha esposa."
ACT_1_65.4,"Kaede was probably in the shrine then, climbing the 19,999 stairs barefooted.","Kaede provavelmente estava no santuário, subindo os 19,999 degraus descalça."
ACT_1_65.5,"I am pretty sure that earlier she just planned to pray for a healthy birth of our son that was 8 months old in her belly at this point, but considering the situation now, praying for my safety was definitely added to her list of prayers.","Tenho quase certeza que antes ela apenas planejava rezar por um nascimento saudável do nosso filho que estava há 8 meses em seu ventre, mas considerando a situação atual, rezar por minha segurança definitivamente fora adicionada à sua lista de orações."
ACT_1_65.6,"'This is General Himekawa's office speaking, how can I help?'","'Aqui é do escritório do General Himekawa, como posso ajudar?'"
ACT_1_65.7,"The receptionist's voice was huffing and puffing all over the place. With each word that she said, there were exhaustive breaths accompanying them. She and her lungs both just wanted to get over with this.","A voz da recepcionista estava acelerada e bufando. Com cada palavra dita, haviam respirações exaustivas acompanhando-as. Ela e seus pulmões apenas queriam que isso acabasse logo."
ACT_1_65.8,"If it was any other day, I would've judged her harshly.","Se fosse qualquer outro dia, eu a teria julgado severamente."
ACT_1_65.9,"However, as the situation stood around, I could do nothing but empathize with her.","Entretanto, considerando a situação ao nosso redor, eu não conseguia fazer nada além de simpatizar com ela."
ACT_1_66.1,"'Love to [i]Yhafa[/i] to you as well! This is Officer Isidro speaking, requesting immediate word with the General. Know that there can't be much delay in communication, the situation is kind of important and needs a word with immediacy.'","'Amor a [i]Yhafa[/i] para você também! Aqui é o Oficial Isidro falando, solicitando comunicação imediata com o General. Saiba que não podem haver muitos atrasos na comunicação, a situação é meio importante e precisa ser tratada imediatamente.'"
ACT_1_66.2,"I don't know how I managed to get that entire sentence out of the way without even coughing once, but it felt like my throat was finally going easy on me.","Eu não sei como consegui falar toda aquela frase sem tossir uma única vez, mas eu senti que minha garganta finalmente estava me dando uma folga."
ACT_1_66.3,"'COFF...COFF...ack...' Well, I celebrated too soon.","'COFF... COFF... Ack...' Bem, eu celebrara muito cedo."
ACT_1_66.4,"'Sir are you alright?' The receptionist's voice spoke out in concern. I could've replied saying, 'the same thing goes for you!' because her voice sounded at the edge of breaking, but for now, I decided to avoid any unnecessary comments.","'Senhor, você está bem?' A voz da recepcionista perguntou preocupada. Eu podia ter respondido dizendo, 'O mesmo vale para você!' pois a voz dela parecia estar no limite, mas por agora, eu decidi evitar quaisquer comentários desnecessários."
ACT_1_66.5,'Just establish communication with the General.,'Apenas estabeleça comunicação com o General.
ACT_1_66.6,That's an order.',Isso é uma ordem.'
ACT_1_67.1,"She didn't reply much after that, and just four and a half minutes later, the general was on the line.","Ela não respondeu muito depois disso, e apenas quatro minutos e meio depois, o general estava na linha."
ACT_1_67.2,'Isidro...','Isidro...'
ACT_1_67.3,From the general's voice I knew he was mad.,Pela voz do general eu sabia que ele estava irritado.
ACT_1_67.4,How could he not?,Como poderia não estar?
ACT_1_67.5,"The thing was supposed to be suppressed and wrapped up by yesterday, but now things were getting out of hand.","A coisa deveria ter sido suprimida e resolvida até ontem, mas agora as coisas estavam saindo do controle."
ACT_1_67.6,"I wouldn't blame him for being mad, I would be mad too if I was in his place.","Eu não o culparia por ficar irritado, eu ficaria irritado também se estivesse em seu lugar."
ACT_1_67.7,'General...','General...'
ACT_1_67.8,The air around me was getting tighter and tighter.,O ar ao meu redor estava ficando cada vez mais apertado.
ACT_1_67.9,"If I could, I would've punched a hole on the wall just so I could smell some air coming in.","Se eu pudesse, eu socaria um buraco na parede apenas para poder respirar um pouco de ar que entrava."
ACT_1_67.10,'What's the news from the outpost at [i]Ufana?[/i]','Quais são as notícias do posto em [i]Ufana[/i]?'
ACT_1_67.11,"'Sir, the outpost in [i]Ufana[/i] has requested up to 60 ground soldiers or 60 counter-terrorism enforcement on nearby districts and outposts. Apparently, students and rebels related to the free [i]Conferri[/i] movement have more ammunition and weapon types. There are also loud source propagandas in relation to free [i]Conferri[/i] movement recorded and broadcasted through loudspeakers all over the area, whose initial sources are yet to be determined. We are trying not to shoot out the loudspeakers until the source is located.'","'Senhor, o posto em [i]Ufana[/i] solicitou até 60 soldados de campo ou 60 reforços anti-terrorismo de distritos e postos próximos. Aparentemente, estudantes e rebeldes relacionados ao movimento libertário [i]Conferri[/i] têm mais munição e tipos de armas. Há também propaganda relacionadas ao movimento libertário [i]Conferri[/i] gravada e sendo transmitida por auto-falantes por toda a área, cuja fontes iniciais ainda hão de ser determinadas. Estamos tentando não atirar nos auto-falantes até a fonte ser localizada.'"
ACT_1_68.1,"I almost expected the general to scream at this point, my heart was even ready for it.","Eu quase esperava que o general gritasse a essa altura, meu coração estava até mesmo pronto para isso."
ACT_1_68.2,"However, I heard three taps of finger on the table, and then, 'Blow up the buildings.'","Entretanto, eu ouvi três batidas de seu dedo na mesa, e então, 'Exploda os prédios.'"
ACT_1_69.1,'I-I am sorry sir. But the repairs of the infrastructure cost would…','D-desculpe senhor. Mas os custos de reparos da infraestrutura seriam...'
ACT_1_69.2,"'With all due respect officer, I DON'T FUCKING CARE!","'Com todo o respeito, oficial, EU TO CAGANDO!"
ACT_1_69.3,"This incident has already gone international, and similar protests are erupting in [i]Youkandero[/i] and [i]Eragonate[/i] as well. This situation has gone out of hand by giving these terrorists much more attention than they needed.","Esse incidente já se tornou internacional, e protestos similares estão nascendo em [i]Youkandero[/i] e [i]Eragonate[/i] também. Essa situação fugiu do controle ao dar-mos a esses terroristas mais atenção do que precisavam."
ACT_1_69.4,"I have already gotten four calls from our great leader himself, and he is furious. At one point he even said that my head could be on the chopping block.","Eu já recebi quatro ligações do nosso grande líder em pessoa, e ele está furioso. Em um momento ele até disse que minha cabeça poderia estar na forca."
ACT_1_69.5,"Well, officer, I think you understand that if my fucking head could be on the chopping block, then so can yours.","Bem, oficial, eu acho que você entende que se a porra da minha cabeça pode estar na forca, então a sua também pode."
ACT_1_69.6,"If we let this go on any longer, the cost of shame would be ten times higher than any infrastructure repair cost. Aside from that school and statue of our great leader, all the buildings, no matter how important, are to be immediately destroyed, and any escaping terrorists to be eliminated. Take only a few prisoners if possible and make sure no [i]Conferri[/i] fuck blows up the statue of our great leader.","Se deixarmos isso continuar, o custo da vergonha seria dez vezes maior do que qualquer custo de reparos em infraestrutura. Além daquela escola e da estátua de nosso grande líder, todos os prédios, não importa o quão importantes, devem ser imediatamente destruídos. e qualquer terrorista fugitivo deve ser eliminado. Faça apenas alguns prisioneiros se possível e certifique-se que nenhum filho da puta [i]Conferri[/i] exploda a estátua de nosso grande líder."
ACT_1_69.7,IT'S AN ORDER OFFICER!',"ISSO É UMA ORDEM, OFICIAL!'"
ACT_1_70.1,'S-sir...','S-senhor...'
ACT_1_70.2,"my heart might have stopped pumping blood for a minute, because I felt myself involuntarily taking very heavy, and very long breaths.","meu coração pode ter parado de bombear sangue por um minuto, porque eu me senti involuntariamente respirando de maneira longa e pesada."
ACT_1_70.3,"I wanted the breathing to stop, at least till my talk with the general was finished.","Eu queria que a respiração parasse, pelo menos até minha conversa com o general ter terminado."
ACT_1_71.1,"'You understand orders, don't you, officer?' My breaths only got heavier.","'Você entende ordens, não é, oficial?' Minha respiração apenas se tornara mais pesada."
ACT_1_71.2,Stop.,Pare.
ACT_1_71.3,.…,...
ACT_1_71.4,FUCKING STOP!,"CARALHO, PARA!"
ACT_1_71.5,STOP,PARA
ACT_1_72.1,"'I said, do you or do you not understand the orders, officer?!","'Eu disse, você entendeu ou você não entendeu as ordens, oficial?!"
ACT_1_72.2,Because all I can hear from your side is a balloon out of air.,Pois tudo o que consigo ouvir do seu lado é um balão sem ar.
ACT_1_72.3,I want you to get your discipline back and be a man the very next moment or.…',"Eu quero que você recupere a disciplina e torne-se um homem logo em seguida, ou...'"
ACT_1_72.4,'YES SIR!','SIM SENHOR!'
ACT_1_72.5,That shout took a lot out of my body.,Aquele grito exigira demais do meu corpo.
ACT_1_72.6,"At some point, though briefly, I could feel my ribcage detach from my lungs. The nerves around there stretching my skin, and all the pressure giving stress to my chest that eventually spiraled itself into my heart.","Em algum momento, apesar de brevemente, eu senti minha caixa torácica desprender de meus pulmões. Os nervos ao redor estavam esticando minha pele, e toda a pressão estressando meu peito que eventualmente espiralou até meu coração."
ACT_1_72.7,"One more shout like this, and I would be there with Isamu in the medical room, wishing to wake up soon before the force learned of my weakness.","Mais um grito como esse, e eu estaria lá com Isamu na enfermaria, desejando acordar logo antes que a força descobrisse minha fraqueza."
ACT_1_72.8,"'Good. Now, straighten up, and keep your mind awake and forward the message. They have the permission to ask 30 men troop at best, and that could either be ground force or counter-terrorism, at this point I don't fucking care. Whatever gets this over, will work. I want to hear only good news 12 hours later, or you very well know that not only you, but me as well would be praying to god for our lives.'","'Bom. Agora, endireite-se, e mantenha a mente desperta e encaminhe a mensagem. Eles têm permissão de pedir 30 homens no máximo, e podem ser ambos força de campo ou anti-terrorismo, a essa altura eu não ligo mais pra essa porra. O que for necessário para acabar com isso vai servir. Eu quero ouvir apenas boas notícias 12 horas depois, ou você sabe que não apenas eu, mas você também podemos estar rezando a deus por nossas vidas.'"
ACT_1_73.1,"'Thank you sir, Love to...'","'Obrigado senhor, Amor a...'"
ACT_1_73.2,"Before I could give my respects, the general immediately slammed the receiver on his end. My job was clear now, and I could only wish for things to end one way or..…","Antes que eu pudesse prestar meus respeitos, o general imediatamente bateu o telefone. Meu trabalho agora estava claro, e eu podia apenas desejar para que as coisas terminassem de uma maneira ou..."
ACT_1_73.3,"No. It should only end one way, for the other way was something I could not afford.","Não. Elas deveriam acabar apenas de uma maneira, pois a outra era algo a qual eu não podia pagar."
ACT_1_74.1,"With my ever thumping heart, I dialed the phone to my junior,","Com meu coração disparado, disquei o número do meu subordinado,"
ACT_1_74.2,"'Deploy 30 counter-terrorist squads to [i]Ufana[/i] immediately. Try Outpost 3 near [i]Ghozikla[/i] district, they seem to have the numbers and ammunition. Tell them that any property that is not the school or the great leader's statue is to be immediately blasted. If you are wishing to give any concerns on this matter, then keep them to yourself. The order comes directly from the general, and possibly the great leader himself. We have no decision on this. All we can do is follow orders. You understand?'","Mobilize 30 esquadrões anti-terrorismo para [i]Ufana[/i] imediatamente. Tente o Posto 3 perto do distrito de [i]Ghozikla[/i], eles parecem ter o número e a munição. Diga-os que qualquer propriedade além da escola ou da estátua do grande líder deve ser imediatamente explodida. Se estiver querendo expressar qualquer preocupação com essa ordem, então mantenha-as para si. A ordem veio diretamente do general, e possivelmente do próprio grande líder. Não temos escolha quanto a isso. Tudo o que podemos fazer é seguir ordens. Você entender?'"
ACT_1_74.3,'Yes sir.' The junior replied on the other end.,Sim senhor.' O subordinado respondeu do outro lado.
ACT_1_74.4,"'Good, establish communication immediately.'","'Bom, estabeleça comunicação imediatamente.'"
ACT_1_75.1,"Cutting the call, I immediately dialed the number to Rikki's outpost again.","Encerrando a ligação, imediatamente disquei o número do posto de Rikki novamente."
ACT_1_75.2,A soldier picked it up.,Um soldado atendeu.
ACT_1_75.3,"He too tried to let out the words, 'Love to [i]Yha[/i]…' but I cut him short saying, 'Soldier, I have no time for greetings or saluting the motherland. I want you to put Captain Rikki Takahashi immediately on the line.'","Ele também tentou dizer as palavras 'Amor a [i]Yha[/i]...' mas eu o cortei dizendo, 'Soldado, não tenho tempo para cumprimentos ou saudações à pátria mãe. Quero que coloque o Capitão Rikki Takahashi na linha imediatamente.'"
ACT_1_75.4,"The soldier let out a very small, and very obedient,","O soldado soltou um muito pequeno, e muito obediente,"
ACT_1_75.5,"'Yes sir,'","'Sim senhor,'"
ACT_1_75.6,"and shouted to one of his colleagues, 'Igarashi! Get captain Rikki on line, immediately!'","e gritou a um de seus colegas, 'Igarashi! Coloque o Capitão Rikki na linha imediatamente!'"
ACT_1_76.1,"Thirty seconds later, Rikki was talking to me. His first words were, 'So, what did the general say?'","Trinta segundos depois, Rikki estava falando comigo. Suas primeiras palavras foram, 'Então, o que o general disse?'"
ACT_1_76.2,"'Thirty man counter-terrorist troops are on the way. Ground soldiers will only be applicable if this is not resolved in the next 12 hours. But, on the brighter side for you, you have the permission to blow up buildings that are not the school or the great leader's statue. Also, I know you know already, but make sure to protect the statute. They may attempt an attack on that.'","'Trinta tropas anti-terrorismo estão a caminho. Soldados de campo só serão aplicáveis se isso não for resolvido nas próximas 12 horas. Mas, pelo lado positivo para você, você tem permissão de explodir prédios que não são a escola ou a estátua do grande líder. E também, eu sei que você já sabe, mas certifique-se de proteger a estátua. Eles podem tentar atacá-la.'"
ACT_1_76.3,"'I am sorry, what?!' Rikki's voice was not pleased.","'Perdão, o que?!' a voz de Rikki não era agradável."
ACT_1_76.4,"'This has become an international event at this point, before the [i]Conferri[/i] rebellion starts getting any sympathetic recruitment and similar instances of revolt; it needs to be finished immediately.'","'Isso se tornou um evento internacional a essa altura, antes que a rebelião [i]Conferri[/i] comece a receber recrutas simpatizantes e revoltas similares nasçam; ela precisa ser encerrada imediatamente.'"
ACT_1_77.1,"'I got that part,' Rikki was gritting his teeth on the other hand, if I stressed my ears a little bit more, I could've heard the remnants of the latest handful of tobacco he chewed, striking between his teeth, 'But you know very well these include the water supply buildings, steel warehouses, and the FUCKING food market itself.'","'Eu entendi essa parte,' Rikki estava raspando os dentes. e se eu forçasse um pouco os ouvidos, poderia ouvir os restos do último punhado de tabaco que ele mascara batendo entre seus dentes. 'Mas você sabe muito bem que isso inclui prédios de suprimento de água, armazéns de aço, e a PORRA do mercado de comida.'"
ACT_1_77.2,'Rikki...,'Rikki...'
ACT_1_77.3,sir. I should repeat that this is an international incident now.,senhor. Devo repetir que isso é um incidente internacional agora.
ACT_1_77.4,"If we let this carry on for much longer, the great leader would have our heads on the chopping blocks.","Se deixarmos isso se prolongar, o grande líder colocaria nossas cabeças na forca."
ACT_1_77.5,"Even the general fears for his life, and if the general fears for his life, you very well know that we both do not stand a chance.","Até o general teme por sua vida, e se o general teme por sua vida, você sabe muito bem que não temos chance nenhuma."
ACT_1_77.6,We will have to take some losses to gain things.',Precisamos sacrificar algumas coisas para vencer.'
ACT_1_77.7,'Do we need to take prisoners?','Precisamos fazer prisioneiros?'
ACT_1_77.8,"'Maybe the leader if possible, but the rest could be executed.'","'Talvez o líder se possível, mas o resto pode ser executado.'"
ACT_1_78.1,"'Okay,' Though I only spoke to him on the phone, I could imagine Rikki rubbing his temple at this point, either trying to massage his worries away or just wiping of the sweat that was collectively forming on all his skin, 'When are the counter-terrorist force arriving?'","'Ok,' apesar de só falar com ele pelo telefone, eu podia imaginar Rikki esfregando as têmporas a essa altura, ou tentando massagear suas preocupações ou apenas limpando o suor que se coletava em toda a sua pele, 'Quando que as forças contra-terroristas chegarão?'"
ACT_1_78.2,"'We contacted the one in outpost-3 in [i]Ghozikla[/i], they should arrive in 60-70 minutes, maybe faster considering the ordered curfew would have made the streets clearer, so you could actually expect 30-40 minutes at maximum.'","'Nós contatamos a do posto-3 em [i]Ghozikla[/i], eles devem chegar em 60-70 minutos, talvez mais rápido se considerando que o toque de recolher deixou as ruas mais vazias, então pode esperar na verdade 30-40 minutos no máximo.'"
ACT_1_78.3,'Alright...','Certo...'
ACT_1_78.4,"Rikki started taking long heavy breaths, and with a croak in his voice he continued, 'Ronan…'","Rikki começou a respirar fundo, e com um coaxar na voz continuou, 'Ronan...'"
ACT_1_78.5,"'Yes, sir.'","'Sim, senhor.'"
ACT_1_78.6,"'Don't call me sir, I am sorry for earlier.'","'Não me chame de senhor, sinto muito por antes.'"
ACT_1_79.1,The vocal abuse from Rikki was something I was used to.,O abuso vocal de Rikki era algo a qual eu estava acostumado.
ACT_1_79.2,"Apologies, not.","Desculpas, não."
ACT_1_79.3,"It was not his first apology to me, but still, him apologizing felt really strange.","Não era a primeira vez que ele se desculpava comigo, mas ainda assim, ouví-lo se desculpando era muito estranho."
ACT_1_79.4,"'Look,' his voice gathered all the emotions he could, 'After this situation is over, I will request that you get a good holiday. It's still a fresh marriage for you, and you are soon to have a child. You should be there for his birth and not rotting away picking debris from a situation that could've been handled immediately. I mean, you refused every invitation from us going to that [i]Conferri[/i] brothel, so you are a rare species of a loyal husband. I respect you for that man, so when this is all over, take this one from me and spend time with your wife and son. I...hope it is a son. Maybe he would be as bold as his father. If not, then the girl you get would be a good future bride for my Sanshiro.'","'Olha,' sua voz juntara toda a emoção que podia, 'Depois que essa situação tenha acabado, vou solicitar que você tenha umas boas férias. Ainda é um casamento novo para você, e você está prestes a ter um filho. Você deveria estar lá para seu nascimento e não apodrecendo recolhendo detritos de uma situação que poderia ter sido resolvida imediatamente. Quero dizer, você recusou todos os convites meus para ir àquele bordel [i]Conferri[/i], então você é uma espécie rara de marido leal. Eu respeito isso em você, cara, então quando tudo isso acabar, faça isso por mim e passe tempo com sua esposa e filho. Eu... Espero que seja um filho. Talvez ele seja tão corajoso quanto o pai. Se não, então a garota seria uma boa futura noiva para meu Sanshiro.'"
ACT_1_80.1,"I wanted to reply with a thank you, but I was still gathering the fact that Captain Rikki Takahashi himself was apologizing to me.","Eu queria responder com um obrigado, mas ainda estava me recompondo do fato de que o Capitão Rikki Takahashi em pessoa ter se desculpado comigo."
ACT_1_80.2,It was the first time since his son's birth that we had talked like this.,Era a primeira vez desde o nascimento de seu filho em que conversávamos assim.
ACT_1_80.3,'Thank you. I promise that my son will…','Obrigado. Prometo que meu filho será...'
ACT_1_80.4,"'Keep your thanks to yourself. Just promise that in ten years when you get sick of the vegetable of a marriage that you have, I will be the one to show you around the brothel. I-I,' at this point he hesitated, he was suddenly gathering his breath, like he was an actor trying to remember a line in a play or something, and then taking out a giant sigh he spoke, 'I know this girl who goes by this western name Gigi, even wears a blonde wig and pretends to speak English. Well, her English is not good, but the...the....th-the hand stuff, she is a master at,' Rikki was chuckling on the other side, but all I could do was think of Kaede. She might have already reached the top of the shrine, hopefully without collapsing. Well, her friends were there with her, but still...","'Guarde seus agradecimentos para si mesmo. Apenas prometa que em dez anos quando você se cansar daquele vegetal de casamento que você tem, eu serei aquele que te apresentará a um bordel. E-eu,' nesse momento ele hesitou, subitamente respirou fundo, como se fosse um ator tentando se lembrar da fala em uma peça ou algo assim, e então falando com um longo suspiro disse, 'Eu conheço essa garota que usa o nome ocidental Gigi, até usa uma peruca loira e finge falar inglês. Bem, seu inglês não é bom, mas a... A... A-a coisa com a mão, ela é mestre nisso,' Rikki estava rindo do outro lado da linha. mas tudo no que eu conseguia pensar era Kaede. Ela talvez já tenha alcançado o topo do santuário, com sorte sem colapsar. Bem, suas amigas estavam lá com ela, mas mesmo assim..."
ACT_1_81.1,"'Anyway, get a short nap, I will update you on the situation,'","'Enfim, tire um bom cochilo, eu irei te atualizar sobre a situação,'"
ACT_1_81.2,"Without saying any byes or see you laters, Rikki kept down the receiver on his side.","sem nenhum tchau ou te vejo mais tarde, Rikki desligou o telefone."
ACT_1_81.3,"Taking his advice, I kept down one on my end as well, and dialed the junior.","Seguindo seu conselho, também desliguei o telefone, e disquei para meu subordinado."
ACT_1_81.4,"'Sir,' his nigh robotic voice spoke from the other side.","'Senhor,' sua voz quase robótica disse do outro lado."
ACT_1_81.5,"'I am taking a forty minute nap. Tell Seiko to wake me up after that amount of time only, unless there is anything urgent.'","'Vou tirar um cochilo de quarenta minutos. Diga à Seiko para me acordar apenas depois desse tempo, a menos que algo urgente aconteça.'"
