keys,en,pt_BR
ACT_1_32.1,"But most of all, my joints wished for a more comfortable place to sit in than the steel chair that was provided to me.","Mas acima de tudo, minha juntas desejavam um lugar mais confortável para sentar além da cadeira de aço que me fora providenciada."
ACT_1_32.2,"I had even scratched my hands once or twice before because of how rusty it was. I had demanded changes before, like a month before, but ordering a comfortable chair for work, even for the Head Clerk and Manager of the Communication Department of an important division, was a difficult task.","Eu até arranhara minhas mãos uma ou duas vezes antes devido a quantidade de ferrugem nela. Eu exigira mudanças antes, mas exigir uma cadeira confortável para o trabalho, mesmo para o Chefe Escrivão e Gerente do Departamento de Comunicação de uma importante divisão, era uma tarefa difícil."
ACT_1_32.3,"To be honest, the entire division was underfunded for years at this point, as most of the funds of reconstruction...and weaponry was sent to outposts at the border with our neighbor, [i]Sutwandra[/i], who held many exiles from the [i]Conferri[/i] unification.","Para ser honesto, a divisão inteira estava com o orçamento baixo há anos, já que maior parte dos fundos de reconstrução e armamento eram mandados a postos na fronteira com nosso vizinho [i]Sutwandra[/i], que abrigava muitos exilados da unificação [i]Conferri[/i]."
ACT_1_32.4,"We were a communication and clerical HQ anyway, so it shouldn't have been much of a problem.","Nós éramos um QG de comunicação e escriturário de qualquer maneira, então não deveria ter sido um problema tão grande."
ACT_1_32.5,"Since most of our military spending obviously went to getting and maintaining communication devices like phones and radio signals, and clerical equipments like typewriter, papers, and folders.","Já que a maior parte de nossos gastos militares iam para obter e manter dispositivos de comunicação como sinais de telefone e rádio, e equipamentos escriturários como máquinas de escrever, papéis, e pastas."
ACT_1_32.6,"So I shouldn't be complaining much, ","Então eu não deveria estar reclamando tanto,"
ACT_1_32.7,"but at a time of stress like that, you could not help but wish for at least something better to sit on.","mas em momentos de estresse como esse, você não consegue impedir e deseja por pelo menos algo melhor para se sentar."
ACT_1_33.1,'RONAN!','RONAN!'
ACT_1_33.2,Rikki's scream woke me from my fragile state.,o grito de Rikki me acordou de meu frágil estado.
ACT_1_33.3,"I gripped the receiver harder, feeling the sweat that dropped from my forehead to the upper-cap of the receiver and slowly trickled down from its handle, to rejoin my body at my hand again.","Eu segurei o telefone com mais força, sentindo o suor que pingava de minha testa na parte superior do telefone e lentamente escorria pela alça, para se juntar novamente ao meu corpo na minha mão."
ACT_1_33.4,'RONAN! Reply goddamn it!',"'RONAN! Responda, droga!'"
ACT_1_33.5,Rikki's scream turned into a full blown command.,o grito de Rikki se tornou um comando completo.
ACT_1_34.1,"When nauseous, you could try your best to avoid a scream, but it is always advisable to those who wished to see another day to never ever disobey a command from your superior.","Quando se está nauseado, você pode tentar ao máximo evitar gritar, mas é sempre recomendado àqueles que desejam viver mais um dia nunca desobedecer um comando de seu superior."
ACT_1_34.2,"Even if you are dead, make sure you follow whatever is asked from you.","Mesmo que você esteja morto, certifique-se de obedecer o que quer que tenha sido pedido de você."
ACT_1_34.3,"Yes, you must be laughing at that last sentence right now.","Sim, você deve estar rindo dessa última frase agora."
ACT_1_34.4,I can only wish I could laugh with you.,Eu só queria poder rir com você.
ACT_1_34.5,'How can a person obey commands when they are already dead?','Como pode uma pessoa obedecer ordens quando ela já está morta?'
ACT_1_34.6,"Well my grandfather used to say it all the time that fear, you see, is something that is carried in the soul, not in the body.","Bem, meu avô costumava dizer o tempo todo de que o medo, veja bem, é algo carregado na alma, e não no corpo."
ACT_1_34.7,"And if there was one thing that the superiors of the [i]Yhafa[/i] in army were good at instilling, it was the fear of their commands.","E se havia uma coisa que os superiores do exército de [i]Yhafa[/i] eram bons em causar, era o medo de seus comandos."
ACT_1_35.1,"In fact, at the risk of taking you away from the main tale for a while, here is a joke that is very common in [i]Yhafa[/i]'s army camps:","Na verdade, sob o risco de de distrair do conto principal por um momento, aqui está uma piada muito comum nos acampamentos do exército de [i]Yhafa[/i]:"
ACT_1_35.2,"Once a general asked one of the soldiers to buy some vegetables from the market. On the way back, his jeep was attacked by terrorists, and nothing but the hand of the soldier survived. Two days later, in the town, talks of a mysterious hand hopping around started to make rounds.","Existia um general que pediu a um de seus soldados para comprar alguns vegetais do mercado. No caminho de volta, seu jipe fora atacado por terroristas, e nada além da mão do soldado sobreviveu. Dois dias depois, na cidade, boatos sobre uma mão misteriosa pulando por aí começou a correr de boca em boca."
ACT_1_35.3,"An army guard told the newspaper, 'I saw a hand, yes, just a hand, steal my underwear', / a captured terrorist told the newspaper, 'I saw a hand, yes, just a hand, punch me, because of which I was captured',","Um guarda do exército disse ao jornal, 'Eu vi uma mão, sim, apenas uma mão, roubar minha cueca', / 'Um terrorista capturado disse ao jornal, 'Eu vi uma mão, sim, apenas uma mão, me socar, porque eu fui capturado',"
ACT_1_35.4,"and a vegetable seller told the newspaper, 'I saw a hand, yes, just a hand, bring me a shopping bag, inside of which was a list of vegetables and a note of 2,000 and 250 tombs, combining together a price of 2,250 tombs from which the hand bought from me a pair of cauliflowers, two bottle gourds, some herbs, and half-a-kilogram of tomatoes.'","e um vendedor de vegetais disse ao jornal, 'Eu vi uma mão, sim, apenas uma mão, trazendo-me uma sacola de compras, e uma nota de 2,000 e outra de 250 tumbas, combinadas no total de 2,250 tumbas que a mão usou para comprar um par de couves-flor, duas abobrinhas, algumas ervas, e meio quilo de tomates.'"
ACT_1_35.5,"As the general was reading the tale of this mysterious hand in the newspaper, there was a knock on his door.","Enquanto o general lia o conto dessa mão misteriosa no jornal, ouviu uma batida em sua porta."
ACT_1_35.6,"He opened the door and found a hand,","Ele abriu a porta e viu uma mão,"
ACT_1_35.7,"yes, just a hand,","sim, apenas uma mão,"
ACT_1_35.8,dragging along a shopping bag full of vegetables.,arrastando uma sacola de compras cheia de vegetais.
ACT_1_35.9,"The general picked up the bag, and the hand looked up in anticipation, wishing for the general's permission to finally die.","O general pegou a sacola, e a mão olhou para cima em antecipação, desejando a permissão do general para finalmente morrer."
ACT_1_36.1,"But instead the general said, 'Oh, today we have some important guests coming! Can you bring me some fresh wine from the brewery? And while you are at it, please take my dog out for a walk as well.'","Mas em vez disso o general disse, 'Ah, hoje nós teremos alguns convidados importantes! Pode me trazer um vinho fresco da destilaria? E enquanto estiver lá, por favor leve meu cachorro para passear também.'"
ACT_1_37.1,He. He.,He. He.
ACT_1_37.2,Wasn't that funny?,Isso não é engraçado?
ACT_1_37.3,I remember having such a laugh at that one when we were in the training camps.,Eu lembro de rir tanto quando estava no acampamento de treino.
ACT_1_37.4,"Those were simpler times, it was a time when Rikki and I were in the same position, and I was the one who always protected his mixed race self from being bullied by other cadets.","Era uma época mais simples, uma época em que Rikki e eu tínhamos a mesma posição, e eu era aquele que protegia a pele mestiça dele de sofrer nas mãos dos outros cadetes."
ACT_1_38.1,About Rikki?,Sobre o Rikki?
ACT_1_38.2,Mixed race you ask?,"Raça mestiça, você pergunta?"
ACT_1_38.3,"Well, the story is simple.","Bem, a história é simples."
ACT_1_38.4,"Even after 110 years of independence from the [i]Hindarav[/i] empire and 100 years of [i]Conferri[/i] separation,","Mesmo após de 110 anos de independência do império [i]Hindarav[/i] e 100 anos da separação [i]Conferri[/i],"
ACT_1_38.5,[i]Yhafa[/i] and [i]Conferri[/i] were both still in a state of poverty.,[i]Yhafa[/i] e [i]Conferri[/i] ainda estavam em um estado de pobreza.
ACT_1_38.6,"Rikki's mother was an activist from some white country, I don't remember its name, but it was either [i]Terro[/i] or [i]Tearao[/i].","A mãe de Rikki era uma ativista de algum país branco, não me lembro do nome, mas era [i]Terro[/i] ou [i]Tearao[/i]."
ACT_1_38.7,The pronunciation for both countries is kind of the same to be honest.,"A pronúncia de ambos os países é meio que a mesma, para ser honesto."
ACT_1_38.8,"Well, long story short, she moved to [i]Yhafa[/i] some ten years before Rikki's birth, fell in love with Rikki's father, married and gave birth to Rikki","Bem, em resumo, ela se mudou para [i]Yhafa[/i] uns dez anos antes do nascimento de Rikki, se apaixonou pelo pai de Rikki, se casou e deu à luz a Rikki"
ACT_1_38.9,"(whose name, if i may clarify, is somewhat written in similar veins to the traditional [i]Yhafa[/i] name ...Riki... with an extra k, and pronounced like the english name ...Ricky..., in order to honor both the parents lineage)","(cujo nome, se posso clarificar, é de certa forma escrito de maneira similar ao nome tradicional de [i]Yhafa[/i] 'Riki' com um K extra, e pronunciado como o nome inglês 'Ricky' para honrar a linhagem de ambos os pais)"
ACT_1_38.10,"and then later was stabbed in the chest by her own husband, who grew jealous every time she even laid eyes on another man.","e posteriormente fora esfaqueada no peito pelo próprio marido, que ficava com ciúmes sempre que ela olhava para outro homem."
ACT_1_39.1,"So,","Então,"
ACT_1_39.2,"back in training years, it was me protecting Rikki,","nos nossos anos de treino, era eu protegendo Rikki,"
ACT_1_39.3,"but over the years, he managed to garner a higher position in the army.","mas com o passar dos anos, ele conquistou uma posição mais elevada no exército."
ACT_1_39.4,"We still loved each other like brothers, but in moments like these he sometimes had a tendency to lose his temper.","Ainda nos amávamos como irmãos, mas em momentos como aquele ele algumas vezes tinha a tendência de perder a paciência."
ACT_1_40.1,"Again,","Novamente,"
ACT_1_40.2,"he is not a bad person, I can assure you.","ele não é uma pessoa ruim, posso te garantir."
ACT_1_40.3,"You are just seeing him at his worst self,","Você apenas está vendo sua pior forma,"
ACT_1_40.4,a self that is so stressed that it doesn't know what it may say.,uma forma que está tão estressada que não sabe mais o que pode falar.
ACT_1_41.1,"'Y-yes, sir,' the voice escaped me.","S-sim, senhor,' a voz escapou de mim."
ACT_1_41.2,"The throat was still rough and dry, so I seriously don't know if Rikki received it as gently as I wished for it to,","A garganta ainda estava áspera e seca, então eu seriamente não sabia dizer se Rikki entendeu a mensagem gentilmente como eu queria,"
ACT_1_41.3,or if he heard my calm reply as yet another scream of anger and frustration on him.,ou se ele ouviu minha resposta calma como outro grito de raiva e frustração contra ele.
ACT_1_42.1,"'Look, just forward the message to the General. Things are really out of control here.'","'Olha, só encaminhe a mensagem ao General. As coisas estão realmente fora de controle aqui.'"
ACT_1_42.2,"His voice seemed calm at this point, maybe he received my earlier reply as I wished for him to receive, or maybe, he had realized that there were bigger concerns at hand.","Sua voz parecia calma a essa altura, talvez ele tenha recebido minha resposta anterior como eu desejara que recebesse, ou talvez, ele percebera que haviam preocupações maiores no momento."
ACT_1_42.3,"Either way, I was in a safe position for now.","De qualquer maneira, eu estava em uma posição segura por hora."
ACT_1_43.1,"'Well, Rikki...'","'Bem, Rikki...'"
ACT_1_43.2,"I had almost forgotten my place again, thank god that I had some sane consciousness left to add, '...sir. I would still...I-I mean....COFF...COFF....the general would still need an explanation about why the situation that was promised to be resolved by yesterday is still persisting today.","Eu quase me esquecera de minha posição novamente, graças a deus eu ainda tinha um pouco de consciência restante para adicionar, '... Senhor. Eu ainda preciso... Q-quero dizer... COFF... COFF... O general ainda precisa de uma explicação sobre por que a situação que fora prometida estar resolvida ontem ainda persiste até hoje."
ACT_1_43.3,And why is there a sudden demand of over 90 soldiers…',E por que há uma súbita demanda de mais de 90 soldados...'
ACT_1_44.1,"Before I could continue further,","Antes que eu pudesse continuar,"
ACT_1_44.2,"Rikki's panicked voice said, '60!","a voz em pânico de Rikki disse, '60!"
ACT_1_44.3,"Tell him 60, not 90.","Diga 60, não 90."
ACT_1_44.4,"I think I might be overshooting his and your patience with 90,","Acho que posso estar extrapolando a paciência dele e a sua com 90,"
ACT_1_44.5,"60 must be enough! Yes,","60 deve ser o bastante! Sim,"
ACT_1_44.6,"yes,","sim,"
ACT_1_44.7,tell him 60!',diga 60!'
ACT_1_45.1,"'Well,' Despite the explanation, I was trying to make the best sense of the sudden change in numbers, 'The general would still demand an explanation.'","'Bem,' apesar da explicação, eu estava tentando compreender a brusca mudança de números, 'o general ainda exigira uma explicação.'"
ACT_1_45.2,"'Well, tell the general that someone provided the student groups with weapons themselves, and I ain't just talking about guns and pistols, they got hand-grenades as well.","'Bem, diga ao general que alguém forneceu aos grupos de estudantes armas, e não estou falando apenas de armas de fogo e pistolas, eles tinham granadas de mão também."
ACT_1_45.3,"Worst of all, it is not just the students now, but almost the entire prefecture that is being a pain for us.","E o pior de tudo, não eram apenas os estudantes agora, mas qualquer a prefeitura inteira estava sendo um saco para nós."
ACT_1_45.4,"They have barricaded their houses to the military, and most people are refusing to surrender.","Eles haviam barricado suas casas contra o exército, e a maioria das pessoas se recusava a se render."
ACT_1_45.5,We are somehow outnumbered and outgunned.,De algum modo estamos em menor número e com menos armas.
ACT_1_45.6,We have lost the only tank we had on this outpost. Nobody even knows when it got blown up...it just fucking did.,Perdemos o único tanque que tínhamos nesse posto. Ninguém sabe quando ele explodiu... Aquela porra simplesmente aconteceu.
ACT_1_45.7,They are playing that dead old [i]Conferri[/i] national anthem again and again on the loudspeakers as well.,Estão tocando aquele hino nacional [i]Conferri[/i] morto de novo e de novo nos auto-falantes também.
ACT_1_45.8,That fucking song is like someone scratching thermocol sheet I tell you!',"Aquela porra de música é como alguém esfregando uma placa de isopor, vou te falar!'"
ACT_1_46.1,"I stressed my ears a little, and was able to make out some of the lyrics of the song.","Eu forcei um pouco os ouvidos, e pude distinguir parte da letra da música."
ACT_1_46.2,"Mainly the ‘[i]for winds be the god, angels be the tree, when you stretch your eyes around, you will see the land of free,[/i]' part of the song that usually was just a medium pitched part of the song, was recorded in the highest of pitch, especially the word, 'free'.","Principalmente a parte '[i]que os ventos sejam o deus, anjos sejam a árvore, quando esticar seus olhos ao redor, verá a terra da liberdade,[/i]' da música que geralmente era apenas uma parte em tom mediano, fora gravada da maneira mais aguda possível, especialmente a palavra, 'liberdade'."
ACT_1_46.3,"It was basically not even high pitched, but a scream.","Basicamente não era nem aguda, mas um grito."
ACT_1_47.1,"'It's alright Rikki sir, it's alright,' I tried being reassuring the entire time, wishing not to trouble him any further, 'I will forward the message to the general.'","'Está tudo bem Rikki senhor, está tudo bem,' eu tentei reconfortá-lo o tempo inteiro, desejando não perturbá-lo ainda mais, 'Irei encaminhar a mensagem ao general.'"
ACT_1_48.1,"'Good, try to make it quick please. I do not know how longer we can hold. They have already replaced some of the [i]Yhafa[/i] flags with the [i]Conferri[/i] flags. The gall of these people I tell you.'","'Bom, tente ser rápido, por favor. Não sei por quanto mais tempo podemos segurar. Eles já substituíram algumas bandeiras de [i]Yhafa[/i] com bandeiras de [i]Conferri[/i]. A coragem dessas pessoas, vou te dizer.'"
ACT_1_49.1,"I crashed down on the chair muttering, 'No, please... Please', to myself.","Eu caí na cadeira murmurando, 'Não, por favor... Por favor', para mim mesmo."
ACT_1_49.2,"Sweat was still trickling down my entire body, and I could only wish for it to stop.","Suor escorria por todo o meu corpo, e eu só conseguia desejar que ele parasse."
ACT_1_49.3,"My body was aching all over the place, if my mind even had a second's rest to think anything, it would've wished for me to die.","Meu corpo doía por todos os lados, se minha mente tivesse um segundo para descansar e pensar em qualquer coisa, desejaria que eu morresse."
ACT_1_49.4,Just imagining those flags going down sent shivers to my body.,Apenas imaginar aquelas bandeiras caindo deu calafrios por todo o meu corpo.
ACT_1_50.1,"I staggered out of my chair, picked up the telephone, and dialed the number of my junior clerk.","Eu me arrastei de minha cadeira, peguei o telefone, e disquei o número do meu escrivão subordinado."
ACT_1_51.1,"Before I could even hear a single ring on my side, the junior clerk picked it up.","Antes que eu ouvisse um único toque do meu lado, o escrivão subordinado atendeu."
ACT_1_51.2,'What can I do for you sir?',"'O que posso fazer por você, senhor?'"
ACT_1_51.3,I had called him so many times in the span of three days that at this point all formalities or praising the nation was off the table.,Eu já havia ligado para ele tantas vezes durante aqueles três dias que a essa altura qualquer formalidade ou saudação à nação estava fora de questão.
ACT_1_51.4,All information needed to be conveyed swiftly.,Toda a informação precisava ser transmitida rápido.
ACT_1_52.1,'I would be calling the general in a few minutes.,'Irei ligar para o general em alguns minutos.
ACT_1_52.2,"Tell all the troops neighboring the [i]Ufana[/i] prefecture, or the [i]Segami[/i] city itself to await an order of troop deployment.'","Diga às tropas vizinhas à prefeitura de [i]Ufana[/i], ou a própria cidade de  [i]Segami[/i], para aguardarem uma ordem de mobilização de tropas.'"
ACT_1_52.3,"My voice was getting raspy at this point, I sounded forty years older than I actually was, 'And tell them to do it quick.","Minha voz estava ficando rouca a essa altura, eu parecia ter quarenta anos a mais do que eu realmente tinha, 'E digam-nos para serem rápidos."
ACT_1_52.4,This situation in [i]Ufana[/i] is turning into a situation [i]Dragon[/i].,Essa situação em [i]Ufana[/i] está se transformando em uma situação [i]Dragão[/i].
ACT_1_52.5,"I am pretty sure the foreign press had gotten their hands on this by now, and would be airing this debacle all over the world.","Tenho quase certeza de que a imprensa internacional já havia colocado as mãos na história a essa altura, e divulgariam esse fracasso por todo o mundo."
ACT_1_52.6,"Trying to suppress the information flow is useless, focus on the counter-measures and we will focus on the foreign and domestic media circulation later on.","Tentar suprimir o fluxo de informação é inútil, foque nas contra-medidas e nós focaremos na circulação das mídias estrangeiras e domésticas depois."
ACT_1_52.7,You understand that?!',Você entender?!'
ACT_1_53.1,"'Yes, sir,'","'Sim, senhor,'"
ACT_1_53.2,It was then I noticed that the voice on the other side was raspy as well.,Foi quando eu percebi que a voz do outro lado da linha também estava rouca.
ACT_1_53.3,"In fact, I am pretty sure the entire office by now was filled with dry throats.","Na verdade, tenho quase certeza de que todo o escritório a essa altura estava repleto de gargantas secas."
ACT_1_53.4,'And soldier...','E soldado...'
ACT_1_53.5,"I replied with the calmest voice I can muster, 'Take a two minute water break for everyone. And tell Seiko to bring a glass of water to my office as well.'","eu respondi com a voz mais calma que conseguia, 'Tire uma folga para água de dois minutos para todos. E diga a Seiko trazer um copo d'água ao meu escritório também.'"
ACT_1_54.1,"'Sir,' the junior said on the other end,","'Senhor,' o subordinado disse do outro lado da linha,"
ACT_1_54.2,"'Can it be three? We have had two people who have already fainted, and it has only been three hours since Isamu was hospitalized after his collapse.'","'Podem ser três? Nós já tivemos duas pessoas que desmaiaram, e fazem apenas três horas desde que Isamu fora hospitalizado após seu colapso.'"
ACT_1_54.3,"'Huh,'","'Huh,'"
ACT_1_54.4,"a long sigh escaped me, 'I will make it three minutes, but that is all the exception I can allow. The situation is really off the rails here.","um longo suspiro escapou de mim, 'Permitirei três minutos, mas essa é toda a exceção que posso permitir. A situação realmente está complicada aqui."
ACT_1_54.5,And about Isamu...',E sobre Isamu...'
ACT_1_55.1,"I knew I was on the telephone, but I could clearly tell that he was pressing his ear very close to the receiver, holding his breath intently.","Eu sabia que estava no telefone, mas conseguia dizer claramente que ele estava pressionando seu ouvindo muito próximo do telefone dele, prendendo a respiração atentamente."
ACT_1_55.2,"Isamu was a dear friend of his, just like how I was with Rikki.","Isamu era um amigo querido dele, assim como eu era de Rikki."
ACT_1_55.3,"He was almost sixty years old at that point, and had served the motherland 42 years straight without ever asking for any promotion.","Ele tinha quase sessenta anos àquela altura, e havia servido a pátria mãe por 42 anos diretos sem pedir nenhum promoção."
ACT_1_55.4,Even I had a certain respect for the old fellow.,Até eu tinha um certo respeito pelo velho colega.
ACT_1_56.1,'You can rest assured that no one will know that he collapsed.,'Pode ficar tranquilo de que ninguém saberá que ele colapsou.
ACT_1_56.2,"I will write in the papers that I sent him out on an important errand, or maybe even as a protection for Seiko when she needed to travel to the nearby outpost to issue supply demands.","Escreverei na papelada de que eu o mandei em uma missão importante, ou talvez até mesmo como proteção para Seiko quando ela precisava viajar ao posto próximo para emitir demandas de suprimentos."
ACT_1_56.3,"Just make sure he recovers fast, I cannot keep up the lie forever.'","Apenas certifique-se de que ele se recupere rápido, eu não posso manter a mentira para sempre.'"
ACT_1_57.1,"As soon as I finished talking, his grateful voice replied,","Assim que terminei de falar, sua voz grata respondeu,"
ACT_1_57.2,'Thank you! Thank you sir!',"'Obrigado! Obrigado, senhor!'"
ACT_1_58.1,"'Now, please get on moving.","'Agora, por favor faça o que pedi."
ACT_1_58.2,"The break is only three minutes, and I desperately wish to have some water myself.'","A folga é de apenas três minutos, e eu desesperadamente desejo um pouco de água também.'"
ACT_1_59.1,"My eyes closed for a minute or two, wishing for a rest from looking at things.","Meus olhos se fecharam por um minuto ou dois, desejando um descanso de olhar para coisas."
ACT_1_59.2,"For the past three days I had only managed to sleep around 1 hour minimum, and 3 hours max.","Pelos últimos três dias eu só conseguira dormir aproximadamente 1 hora no mínimo, e 3 horas no máximo. "
ACT_1_59.3,"My eyes were as red as they came, and if someone didn't know better, they would think I watched television all day with my face just inches away from the screen.","Meus olhos estavam muito vermelhos, e se alguém não me conhecesse, acharia que eu havia assistido televisão o dia todo com o rosto a poucos centímetros da tela."
ACT_1_60.1,"I don't know when, but Seiko might have come in and quietly put the glass of water on my table without disturbing my half-asleep self (which she knew was in an immense state of stress) and exited the office.","Eu não sei quando, mas Seiko pode ter vindo e silenciosamente colocara o copo d'água na minha mesa sem perturbar o meu corpo em meio-sono (que ela sabia estava em um imenso estado de estresse) e saiu do escritório."
ACT_1_60.2,"When I opened my eyes, I drank three quick gulps of water, and letting out a long sigh from my mouth I returned to work again.","Quando abri os olhos, dei três goles rápidos na água, e soltando um longo suspiro bela boca, voltei ao trabalho."
ACT_1_61.1,"I had one hand holding the receiver, and another with my palm spread over my heart.","Eu tinha uma mão segurando o telefone, e a outra com a palma esticada sobre meu coração."
